{
  "schema_version": 1,
  "kind": "source_lab_scenario",
  "id": "sl-source-session-rule-variable-scope-001",
  "revision": 1,
  "status": "candidate",
  "operation": "source_lab_site",
  "capabilities": [
    "CAP-RUNTIME-PORTS",
    "CAP-CONFORMANCE"
  ],
  "compatibility_profile": "android-legado-v1",
  "source": "source.template.json",
  "input": "input.json",
  "transport": {
    "mode": "fixture_and_loopback",
    "external_network": "deny",
    "responses": [
      {
        "id": "rule-data-storage-boundary",
        "match": {
          "method": "GET",
          "path": "/variables/rule-data-storage-boundary",
          "query": {}
        },
        "respond": {
          "status": 200,
          "headers": {
            "content-type": "text/plain; charset=utf-8"
          },
          "body_file": "responses/ok.txt"
        }
      },
      {
        "id": "analyze-rule-priority-and-specials",
        "match": {
          "method": "GET",
          "path": "/variables/analyze-rule-priority-and-specials",
          "query": {}
        },
        "respond": {
          "status": 200,
          "headers": {
            "content-type": "text/plain; charset=utf-8"
          },
          "body_file": "responses/ok.txt"
        }
      },
      {
        "id": "analyze-url-priority-and-specials",
        "match": {
          "method": "GET",
          "path": "/variables/analyze-url-priority-and-specials",
          "query": {}
        },
        "respond": {
          "status": 200,
          "headers": {
            "content-type": "text/plain; charset=utf-8"
          },
          "body_file": "responses/ok.txt"
        }
      },
      {
        "id": "rule-script-shared-propagation",
        "match": {
          "method": "GET",
          "path": "/variables/rule-script-shared-propagation",
          "query": {}
        },
        "respond": {
          "status": 200,
          "headers": {
            "content-type": "text/plain; charset=utf-8"
          },
          "body_file": "responses/ok.txt"
        }
      },
      {
        "id": "url-script-shared-propagation",
        "match": {
          "method": "GET",
          "path": "/variables/url-script-shared-propagation",
          "query": {}
        },
        "respond": {
          "status": 200,
          "headers": {
            "content-type": "text/plain; charset=utf-8"
          },
          "body_file": "responses/ok.txt"
        }
      },
      {
        "id": "failure-keeps-prior-write",
        "match": {
          "method": "GET",
          "path": "/variables/failure-keeps-prior-write",
          "query": {}
        },
        "respond": {
          "status": 200,
          "headers": {
            "content-type": "text/plain; charset=utf-8"
          },
          "body_file": "responses/ok.txt"
        }
      },
      {
        "id": "independent-context-isolation",
        "match": {
          "method": "GET",
          "path": "/variables/independent-context-isolation",
          "query": {}
        },
        "respond": {
          "status": 200,
          "headers": {
            "content-type": "text/plain; charset=utf-8"
          },
          "body_file": "responses/ok.txt"
        }
      }
    ]
  },
  "coverage": [
    {
      "behavior": "runtime.rule-variable-scope",
      "cases": [
        {
          "id": "rule-data-storage-boundary",
          "role": "boundary",
          "android_fact_refs": [
            "AF-WEBBOOK-SEARCH-ENTRYPOINT"
          ],
          "branch_refs": [
            "RuleDataInterface putVariable 10000-character boundary, removal and RuleData big-variable fallback"
          ]
        },
        {
          "id": "analyze-rule-priority-and-specials",
          "role": "nominal",
          "android_fact_refs": [
            "AF-WEBBOOK-SEARCH-ENTRYPOINT"
          ],
          "branch_refs": [
            "AnalyzeRule chapter, book, RuleData and source lookup order plus bookName/title special mappings"
          ]
        },
        {
          "id": "analyze-url-priority-and-specials",
          "role": "nominal",
          "android_fact_refs": [
            "AF-WEBBOOK-SEARCH-ENTRYPOINT"
          ],
          "branch_refs": [
            "AnalyzeUrl chapter and RuleData lookup order, source non-fallback, bookName/title special mappings"
          ]
        },
        {
          "id": "rule-script-shared-propagation",
          "role": "nominal",
          "android_fact_refs": [
            "AF-WEBBOOK-SEARCH-ENTRYPOINT"
          ],
          "branch_refs": [
            "AnalyzeRule JavaScript java.put/java.get persists through shared RuleData into later field evaluation"
          ]
        },
        {
          "id": "url-script-shared-propagation",
          "role": "nominal",
          "android_fact_refs": [
            "AF-WEBBOOK-SEARCH-ENTRYPOINT"
          ],
          "branch_refs": [
            "AnalyzeUrl script write persists through shared RuleData into a later URL template"
          ]
        },
        {
          "id": "failure-keeps-prior-write",
          "role": "malformed",
          "android_fact_refs": [
            "AF-WEBBOOK-SEARCH-ENTRYPOINT"
          ],
          "branch_refs": [
            "AnalyzeRule and AnalyzeUrl script exceptions after java.put expose mutation rollback behavior"
          ]
        },
        {
          "id": "independent-context-isolation",
          "role": "denied",
          "android_fact_refs": [
            "AF-WEBBOOK-SEARCH-ENTRYPOINT"
          ],
          "branch_refs": [
            "Distinct RuleData instances isolate equal variable keys across concurrent pipeline contexts"
          ]
        }
      ]
    }
  ],
  "determinism": {
    "clock": "2026-01-01T00:00:00Z",
    "timezone": "UTC",
    "locale": "en_US_POSIX",
    "random_seed": 37,
    "network_allowed": false,
    "logical_origin": "http://sourcelab.test"
  },
  "limits": {
    "timeout_ms": 1000,
    "max_response_bytes": 1048576,
    "max_request_body_bytes": 1048576,
    "max_requests": 16,
    "max_concurrency": 2
  },
  "provenance": {
    "kind": "synthetic",
    "source_refs": [
      "app/src/main/java/io/legado/app/model/analyzeRule/RuleData.kt",
      "app/src/main/java/io/legado/app/model/analyzeRule/RuleDataInterface.kt",
      "app/src/main/java/io/legado/app/model/analyzeRule/AnalyzeRule.kt",
      "app/src/main/java/io/legado/app/model/analyzeRule/AnalyzeUrl.kt"
    ],
    "introduced_by": "IOS-CHARACTERIZE-SOURCE-SESSION-RULE-VARIABLE-SCOPE-001"
  }
}
