{"schema_version":1,"kind":"source_lab_scenario","id":"sl-reader-inline-image-projection-001","revision":1,"status":"reference","operation":"source_lab_site","capabilities":["CAP-RUNTIME-PORTS","CAP-CONFORMANCE"],"compatibility_profile":"android-legado-v1","source":"source.template.json","input":"input.json","transport":{"mode":"fixture_and_loopback","external_network":"deny","responses":[{"id":"inline-image-content","match":{"method":"GET","path":"/chapter/image","query":{}},"respond":{"status":200,"headers":{"content-type":"text/html; charset=utf-8"},"body_file":"responses/chapter.html"}}]},"coverage":[{"behavior":"pipeline.content-html","cases":[{"id":"inline-image-anchor","role":"nominal","android_fact_refs":["AF-WEBBOOK-CONTENT-ENTRYPOINT"],"branch_refs":["BookContent formats image tags as chapter content and ChapterProvider lays images in reading pages"]}]}],"determinism":{"clock":"2026-01-01T00:00:00Z","timezone":"UTC","locale":"en_US_POSIX","random_seed":104,"network_allowed":false,"logical_origin":"http://sourcelab.test"},"limits":{"timeout_ms":1000,"max_response_bytes":1048576,"max_request_body_bytes":65536,"max_requests":4,"max_concurrency":1},"provenance":{"kind":"synthetic","source_refs":["app/src/main/java/io/legado/app/model/webBook/BookContent.kt","app/src/main/java/io/legado/app/ui/book/read/page/provider/ChapterProvider.kt"],"introduced_by":"IOS-READER-CORE-IMAGE-CONTENT-PROJECTION-001"}}
